{
  "$schema": "http://json-schema.org/draft-04/schema#",
  "type": "object",
  "properties": {
    "name": {
      "type": "string"
    },
    "type": {
      "type": "string"
    },
    "confidence": {
      "type": "number"
    },
    "x": {
      "type": "integer"
    },
    "y": {
      "type": "integer"
    },
    "width": {
      "type": "integer"
    },
    "height": {
      "type": "integer"
    },
    "children": {
      "type": "array",
      "items": [
        {
          "type": "object",
          "properties": {
            "name": {
              "type": "string"
            },
            "type": {
              "type": "string"
            },
            "confidence": {
              "type": "number"
            },
            "x": {
              "type": "integer"
            },
            "y": {
              "type": "integer"
            },
            "width": {
              "type": "integer"
            },
            "height": {
              "type": "integer"
            }
          },
          "required": [
            "name",
            "type",
            "confidence",
            "x",
            "y",
            "width",
            "height"
          ]
        
        }
      ]
    }
  },
  "required": [
    "name",
    "type",
    "confidence",
    "x",
    "y",
    "width",
    "height",
    "children"
  ]
}