{
  "name": "window",
  "type": "container",
  "confidence": 0.97,
  "x": 12,
  "y": 0,
  "width": 45,
  "height": 780,
  "children": [
    {
      "name": "checkbox",
      "type": "checkbox",
      "confidence": 0.97,
      "x": 20,
      "y": 100,
      "width": 200,
      "height": 50
    },
    {
      "name": "button",
      "type": "button",
      "confidence": 0.87,
      "x": 4,
      "y": 10,
      "width": 100,
      "height": 100
    }
  ]
}